Unique ID,Text: Verbatim3QAVNHZ3ENFDVTCJG1ZHEPCIETOAL6,Have a system of sidewalk rail cars that attaches to the sidewalks of a city. Each rail car can carry passenger anywhere in the city to any destination and stop at any time on its route. This system of transportation will greatly reduce city congestion while doesn't interfere with any of the vehicles that are already on the road.3QAVNHZ3ENFDVTCJG1ZHEPCIEZ2ALW,It would be a form of high speed rail that is extremely quiet and runs on Solar energy.3QBD8R3Z22U6ZPZZKS5IT3UCH2L4OM,what is needed is a tubular powered zipline based transportation system. a combination of pnewumatic and electric power will propel people from place to place in a similar manner to a ski lift except it would just be a small tube that has a chain of sorts running in it along the sidewalks. all you would have to do is to have a harness on and when you need to go to one of the destinations you hook on to the line that is color coded for your destination and cruise on down there. Not the most comfortable way to travel but the infrastructure for a neighborhood would be relatively inexpensive.3QBD8R3Z22U6ZPZZKS5IT3UCH5QO4H,vans that drive the same routes all the time that charge a small fee3QECW5O0KIC48087UEARS56DGJPT5K,"A new transportation system uses solar panel on the roads to empower vehicles to travel around the city. As vehicles get on the road, it automatically connects on the server of the roads and energies stored on boxes on street corners come one. These vehicles do not use gasoline, ethanol or diesel. It is greenhouse and uses electricity collected from the sun. Renewable energy that saves money and free to the entire residents meaning as long as the sun still shines, vehicles will work."3QHK8ZVMINTIE3HBMFZD90WOWSXLBY,Have motorcycle drivers go around the city picking up passengers. It would be fun for the passengers and cause less pollution.3QILPRALQ66P05MPVGVIVQACTKAN87,"Another way of transportation would be tube, such as in Futurama.The tube acts as a vacuum and 'carries' you to your destination in the neighborhood."3QILPRALQ66P05MPVGVIVQACTKGN8D,"Ride bicycles.  Get some exercise, leave early and ride a bike."3QILPRALQ66P05MPVGVIVQACTR3N8E,"One day per month (at least) cars should be banned from the roads. Some buses could be allowed to allow for transportation of people who can't walk or bike, but this would be a great way to encourage human-powered transport and allow people to see the fun in this activity without increased danger from car traffic.  This would also be great for the environment."3QIYRE09Y4S7P524WVM3GGN4F9E1N1,driverless pods that can be paged by using a phone app.3QJOXOW4XK20ROBGWI2IALHYZA4ME1,"Public transportation would be ran on hybrid engines, that would be better for emissions, and far more fuel efficient. Future transportation would be far more fuel efficient that runs on alternate forms of power, rather than fossil fuels such as gasoline. These new vehicles would rely less on the oil resource and be cleaner, and far more efficient than before."3QL2OFSM97TRC8C2CSBNXC6VJIPNCL,a fun car that always tells jokes to the passengers3QL2OFSM97TRC8C2CSBNXC6VJO0CNX,"Currently, I live in a small town that has a public transportation system. However, you have to call and wait for the bus to pick you up, instead of waiting at a pre-determined stop, and it can take forever to get where you're going. I propose a busing system that's like the one in bigger cities for my neighborhood. People could still call and wait for a bus, but buses should also stop and pick people up at predetermined stops at regular intervals."3QL2OFSM97TRC8C2CSBNXC6VJRZCN2,There could be a really good motorcycle driver that would drive fast and come pick you up. He would know back roads and side allys very well. He could weve in and out of traffic and get you somewhere really fast.3QL2OFSM97TRC8C2CSBNXC6VJSHCNM,It would be great if we all had hoverboards and could get around like that!3QL2OFSM97TRC8C2CSBNXC6VJWONCC,"A tram. We don't really have trams in the Ohio. It's kind of like a smaller version of a train, but very quiet and low energy. It runs on tracks and electricity."3QL2OFSM97TRC8C2CSBNXC6VJXJCNY,Air Transport - Fastest mode of transport and provides vital support to the national security and defence3QRYMNZ7FZS8YPEDYE6DMM6Z74ONT3,"I'd love a system that is like Uber but just for cheap, shared rides home from the train. It'd cost less than a buck for everyone and operate as a shuttle for people that live within 5 mins of the train."3QUO65DNQVZ5GNTEZYW067S6GGHUO9,Taxis that drive themselves3QUO65DNQVZ5GNTEZYW067S6GMTUOX,"Movable sidewalk, like a super cool huge treadmill"3QXNC7EIPJ6MTEDSZ2ZYKA9A59609B,"Off the ground magnetic rails have high speed autonomous trains that anyone can use, and it gets you to areas much faster than can now be done."3QY5DC2MXSVBAAGL0VDAJDJSORAFUG,Hydrogenase would be an aerial ship for a future low on oil. It’s a hybrid airship that would be entirely reliant on biofuels for transport and that could function as a vessel for a variety of reasons.3QY7M81QH8XKSLW3OYBWPYXDO577K7,Electric rail transports. They existed in Detroit before GM had them eliminated. Essentially bicycle lanes with individual vehicles instead that run on electric wires.3QY7M81QH8XKSLW3OYBWPYXDOI77KX,Paying a fee for a bike that could be used monthly. There would be multiple stations set up where you could place the bike and switch out for others.3QY7M81QH8XKSLW3OYBWPYXDOIY7KO,I would like to see a modern underground railway system installed in my neighbourhood. It would be noiseless and very fast. The railway will connect all the neighbourhood together making it easier to move around. The train would be making stops every half hour  to pick up and drop passengers.3QY7M81QH8XKSLW3OYBWPYXDOZ17KP,Create an underground rail system that allows people to travel to all major hubs of the city. This would save gas and ease pollution.3R08VXYT7D6BNLQKDCUZD9R8B7GW7I,A bus that allows you to be part of a reward system that rewards frequent users to get discounts.3R08VXYT7D6BNLQKDCUZD9R8BC37WQ,"A monorail sort of train, raised over the cityscape and nearly silent as it passes overhead.  There would be platforms raised up several stories high, with elevators to reach street level.  The trains would be sleek and shiny silver or white, gleaming in the sun.  The trains would change smoothly and seamlessly from track to track, so that each one can have a different route."3R08VXYT7D6BNLQKDCUZD9R8BKS7WV,"I would like an interchangeable form of light rail, in which the train would have several compartments that would be destined for multiple locations. That way you just get on the train, and the train goes to an interchange. At the interchange the compartments are separated (I imagine they are held together by magnets) and grouped together by location. Once all the compartments that are going to the same area are together, the train leaves. It would work like changing trains, except you wouldn't have to go outside."3R08VXYT7D6BNLQKDCUZD9R8BSL7W4,future transport is important to our life.3R0T90IZ1TNL2GVGPOYS7SXYI3GCG9,EASILY RENTABLE CAR SERVICE3R0T90IZ1TNL2GVGPOYS7SXYIK5CGW,"One on rails , but it has seats inside a bubble that hangs below the rails."3R0T90IZ1TNL2GVGPOYS7SXYIULGC0,"Similar to the idea of car ride sharing, there could be bike sharing. This already exists on some level, but those bikes are terrible and slow. The bikes could be outfitted with an electric motor, and the motors could be charged via solar panels at the bike stations. This way, people would be more inclined to use them because it would be really easy to get up the hills around here."3R2PKQ87NXJC7TD2S1S9V0FQRQEIMJ,"An automated car pickup system. You connect via an app on a computer, tablet, or cell phone and let the system know the time you need to leave; it then sends a size appropriate vehicle to your door to pick you up and on your way you go!"3R2UR8A0IBRXXRN9437NQERAA0QOXR,no but the same3R2UR8A0IBRXXRN9437NQERAA2XXOB,"special paths for speedwalkers only, no slow walkers, no joggers, just speedwalkers"3R2UR8A0IBRXXRN9437NQERAA3NXO3,Small drones of the size of birds should be invented so that they can monitor the cities properly3R2UR8A0IBRXXRN9437NQERAAAHXOB,Flying cell phone3R2UR8A0IBRXXRN9437NQERAAOGXO2,A ship that takes you around town within minutes and costs less than other methods of transportation.3R2UR8A0IBRXXRN9437NQERAAXPOXK,"Bus lines that run on algorythms generated by apps on citizens' phones in order to insure adequate service and reduce waste.  In off hours, users can ""ping"" the authority before they reach the stop they expect to be picked up at."3R3YRB5GRGEGEJZDPFRI5C81R4ZUA6,"a walkway above the road. it would be totally enclosed and go parallel to the road, not across the road. so people can walk to work/down the main drag without being outside. this would facilitate walking to work."3R3YRB5GRGEGEJZDPFRI5C81RHYAUB,"Having charter buses pick you up from designated spots around the city and dropping you off in various locations around, such as the mall, groceries etc."3R5F3LQFV3VM2MNO5LV8NZ7LI3LOZR,"Have a business where drivers rent cars, for hours and not days. The cars can be electric cars. Make them the cheapest cars possible. Make it for around the metro area only - and have the credit card swiper built into the car itself. In other words If you rent three hours with the car, it goes dead until you pay for more time. If someone takes it out of the pre-defined boundaries  of the city the car goes dead. You would have these little rental kiosks set up all over the city."3R5F3LQFV3VM2MNO5LV8NZ7LIGOZOV,Underground tunnel.  Underground tunnel that allows people to walk during the rain around the neighborhood.3R6BYFZZP8N3REAG50OX3KIWI2QFXT,My idea is : Have you worked int he food industry?3R6BYFZZP8N3REAG50OX3KIWI2XFX0,"A local-government sponsored ridesharing service, much like Uber. However, the proprietors will be the local government, so the commissions from rides will be reinvested into the local community."3R6BYFZZP8N3REAG50OX3KIWIIDFXC,Footpath that moves like an escalator. You get on the footpath which has arrow on it show the direction in which it moves. You will be able to turn with the help of remote control. Has a stop button in case of emergency. And must be solar powered.3R6BYFZZP8N3REAG50OX3KIWIOLFXW,The last new type of teleportation that I can think of would be tubes that connected to certain places and people could get in them to be pushed through to the other end of the tube to another area. They would be large and everywhere so it would only take up space in the air and there would be lots of places to go to.3R6BYFZZP8N3REAG50OX3KIWIWYXF7,We could create tubes connecting major streets that could fit people and ship them through the tunnels in a small fast moving container.3R6BYFZZP8N3REAG50OX3KIWIX9FX2,Conveyor belts that run on the sidewalks.3R6P78PK7LM2OXXRBATIW2X2660GTE,Cell phone teleport3R6P78PK7LM2OXXRBATIW2X26L5GTD,Click to teleport3R6P78PK7LM2OXXRBATIW2X26LFGTN,"In my neighborhood, any public transportation would  be new. We could make rentable bicycles that are in a convenient location"3R8YZBNQ9IT63OUY13VTLK9MNB27Q2,Use bicycles as the exclusive form of transportation. Get rid of all cars.3R8YZBNQ9IT63OUY13VTLK9MNKI7Q0,There should be a system where you can call for the bus to pick you up instead of it stopping at certain stops. It would go to the certain stops also but also pick you up if it has extra space in the time it has so it can save the Earth with carpooling.3R8YZBNQ9IT63OUY13VTLK9MNOO7QE,"I see the potential for self-driving cars to replace taxi services. People would call an automated line, or perhaps interact with a site/app on their computers/phones, to schedule to be picked up by the service. Meanwhile, a network that keeps track of all self-driving cars in its region would figure out which car was closest or would have to deviate the least to pick up the passenger within 5-10 minutes of being hailed. These cars could be compartmentalized to hold four or six passengers without individuals having to worry about undesired contact with the other passengers. The cars could run on electricity and the network would consider battery life with regards to planning routes and destinations."3R9WASFE20RSW9AV6ICI05Y7Q9NZFN,"I think a drone transport system that would carry people, good and other items would be a great service.  An even better idea is if was peer run, meaning run by people in your neighborhood, and all the profits would be split."3R9WASFE20RSW9AV6ICI05Y7QC9FZV,I would suggest that there would be bullet train/subway that would rely on solar power/cooking oil/grease. It would connect to all parts of the continent. It would be energy efficient.3R9WASFE20RSW9AV6ICI05Y7QFTZF5,I would imagine a street car type system that would connect each neighborhood.3R9WASFE20RSW9AV6ICI05Y7QWWZF6,A bicycle rickshaw service.3RANCT1ZVGSLXT45VTRE0NS79ZJBU7,I would love a uber that can run on water and land!3RGU30DZTBJ824X8AJD971UQ408JMR,"My idea relates to my current job in my team lead department: We just need to get on the same page and make sure we are training the new people the same way, or very similar so that aren't any confusions when they go on their own. My idea for WHEN WE ARE TRAINING is to simply develop an exact process that we would do. Step-by-step for the newcomers so there isn't any confusion at all for them or if they have to work with another trainer. This way, we all as trainers, train the exact same way."3RJSC4XJ1153SRBGWCMH8U48J1105A,"A walking pathway across every rooftop in the city.   It would cut down on danger from cars, and it'd be fun to see the scenery.  This could easily be constructed with some good, sturdy planks.  Line them up on the roof, screw them in or hammer them in.  Every building would have a fire escape on it for easy access back to the street.  This would save much time as you could go ""as the eagle flies."" straight across the roofs."3RJSC4XJ1153SRBGWCMH8U48J1W055,"Transportation is mostly done by cars nowadays, but why don't we use rocket powered shoes instead? Flying with footwear is not only cool, it would be much faster than driving."3RJSC4XJ1153SRBGWCMH8U48J8S50K,Taxi drones would be cool. You could tell it where you want to go and it could use GPS technology to pick you up and drop you off.3RU7GD8VPP47MADBPTEFG6F854ZPS8,"Well-defined bicycle lanes throughout the neighborhood, to promote safety for cyclists and pedestrians. Also allows for better control of traffic and fosters better feelings between vehicleists and bicyclists."3RU7GD8VPP47MADBPTEFG6F8590PSJ,Small cars running remotely on designated path evenly spaced that stop when a button is pushed on the side walk.3RU7GD8VPP47MADBPTEFG6F85TGPS3,"I wish we had a monorail between the airport and our city. We aren't connected to any public transportation system, but more than 70% of our residents travel by plane more than once a year. Many people travel for work, etc. Rather than each of us driving and paying to park our cars there, if we could stay in our suburb and take the monorail (or train) to and from it would save a great deal of money and time."3RUIQRXJBCZURC3NDSO7N3ST8W1LLV,Super fast car3RWE2M8QWIL7IGHM0CI32B4UA21N0J,"I think driverless taxi services are going to be the dominant transportation systems in the future. Sort of like having a whole bunch of Uber drivers out there picking up whoever needs it. I don't think that vehicle ownership will be nearly as widespread as it is these days, as driverless cars will be far safer."3RWE2M8QWIL7IGHM0CI32B4UA2BN0T,"Have a transportation system in the city where there is a tunneling system filled miniature train with small passenger capacity. These miniature trains can take people directly to their destination and the best part is that because they are small, there can be a large number of them running underneath the city."3RWE2M8QWIL7IGHM0CI32B4UAGZ0NM,"Have the streets be less wide, in order to have small row gardens on the sides on the sidewalks. This interactive, edible walkway would promote and provide sidewalk snacks and usability. Easy fresh pick veggetables and fruits, less flooding and more city beauty!"3RWE2M8QWIL7IGHM0CI32B4UAMW0NV,"My neighborhood is very organized, but has very few buses.  I'd love to see a ski 'pod' style transportation.  There would be several station, and you would enter a pod, and ride.  There would be a whole network of pod so you could go all over town.  It will also be overhead, like over the sidewalks and bike paths."3RXCAC0YIS0JQD538CIN561FS2W8GG,"a new type of rail system with certain drop off points, but the rail system is above the road so it doesnt interfere with people driving cars."3RXCAC0YIS0JQD538CIN561FS5X8GN,An on demand bicycle system where a truck (with a trailer?) will bring a bicycle to your current location and then you can leave it in place when you're done. Reservations could be made in advance using an app.3RXCAC0YIS0JQD538CIN561FS8LG8P,"In the interest of reducing traffic and accidents, a new series of self-driving only roads and lanes are opened.  On these roads, ONLY self driving cars are authorized to drive, and on them there are no speed limits (not that the self-driving cars would be going that much faster than normal). Unfettered by the chaos of common roads and the limitations of human judgement, these exclusively self-driving vehicle areas allow the navigational AIs to coordinate for an optimally fast and efficient journey."3RXCAC0YIS0JQD538CIN561FS8RG8V,nicer bike paths so more people would be happy to ride a bike3RXCAC0YIS0JQD538CIN561FSK0G8S,Segways!  Segway sidewalks that go over streets and above the normal sidewalks people walk on so you can ride your segway without stopping for traffic or having to worry about a pedestrian taking up space to get by. Segway sidewalks can even run on the edge of a major highway in bigger cities like mine to keep routes short and simple. We can even make the segways charge on solar power so they will never go dead while you're out running about.3RXCAC0YIS0JQD538CIN561FSOS8GK,"I think that some sort of charging commuter car should be parked in every neighborhood. People could coordinate commute times and use electric cars instead of gas, in exchange they pay $1 a day to drive the car per person."3RXCAC0YIS0JQD538CIN561FSP8G8A,"A car pooling app. Non-drivers and those looking for regular rides who normally carpool would join the community and hook up with drivers who are going to their general destination. There would be a monthly fee, which would lowered and even be removed if someone drives/uses their car enough. For example, it's $5 per month, and every time YOU drive it goes down by .50 cents. There's incentive for both non-drivers (a small fee for rides) and drivers (free membership, maybe some gas reimbursement)."3RXCAC0YIS0JQD538CIN561FSRL8GJ,"A vehicle which does not have contact with the earth. That means the vehicle repels with the earth, that is a force against the gravity. The repulsion is constantly managed a new technology so that the vehicle have a permanent distance from the earth. Pressure controllers can be used to create pressure variation in the air and the vehicle moves to the lower pressure area with the air."3RXPCZQMQQM1FDLI9R98QWE7EXNG13,"A network of quadcopters (drones) large enough to transport humans. Let's say you need to get to the other side of town quickly, and want to avoid traffic -- get in a drone and have it deliver you by air!"3RYC5T2D744VLVDYA4EAQWACJ72RPI,"The transportation will be in similar vehicles but on a more fixed schedule, based on the need to be fixed to an automatic track.  Users will log into apps and schedule rides like Uber and traffic space will be monetized."3RYC5T2D744VLVDYA4EAQWACJDLPRB,"Transportation which have free GPS system in it, available for all passengers."3S06PH7KSSFY3TBR7180KBBA17C1DN,"An autonomous car service. This would require the building and investing into self driving cars. You would have a mobile app you can call and request a car and one is immediately dispatched to you. Using your phone you tell it where you want to go. It navigates there. Best of all, this would be free - or very cheap."3S06PH7KSSFY3TBR7180KBBA1AY1DF,"it'd be cool to have a rent a shop throughout the city for people who aren't able to afford bicycles or scooters, or any other sort of transportations. the can rent an item, and return it at the other part of town."3S06PH7KSSFY3TBR7180KBBA1K21D3,"To avoid traffic, airway is most suitable transportation system in the near future. Drones which are capable to carry a person is needs to developed."3S06PH7KSSFY3TBR7180KBBA1N01D7,The subway station can be replaced with magnetic levitation train. The subway train use electrically charged magnets to lift and move above the rail tracks.3S0TNUHWKUTGETVC6MHFZLYIFBG8D8,I think a spiral starting from the center of the city going out to the edges of the city.  The spiral should be able to get all the areas if it's only 2-3 blocks wide.  It would have a dedicated lane so traffic wouldn't affect the bus and vice versa.  There would be a way to quickly have people enter and exit the bus and this would keep it on time.  Of course the bus is electric powered.3S0TNUHWKUTGETVC6MHFZLYIFDH8DD,"An underground network system in the neighborhood, like a subway but only bikes and small motorcycles can travel through. This will be a good way to protect against the weather and steer clear of any incoming cars."3S0TNUHWKUTGETVC6MHFZLYIFG58D7,company that comes in the early morning and scraps and snow/ice off my car3S0TNUHWKUTGETVC6MHFZLYIFGGD8N,I think my neighborhood would benefit from one of those pedal bike bars for the downtown area. There is a lot of history and what better way to enjoy it than while sipping a nice drink and getting some exercise3S0TNUHWKUTGETVC6MHFZLYIFT38DV,Vacuum tubes that transport people around pneumatically. Tubes can go above or below ground and will be powered by compressed air.3S3AMIZX3VGIQWLPNYXK17U1524DCM,"I think teleportation would be awesome. Wouldn't need cars anymore, save on oil and fumes in the environment. People would be happier because they wouldn't be stuck in traffic or have to drive hours to see long distance family members."3S3AMIZX3VGIQWLPNYXK17U154VCDG,"My neighborhood is rural with no public transportation so I believe any addition will be good. However, I feel my town is the perfect candidate for an innovative public bus system. Energy efficient buses for long trips around my town, which does not have a standard grid pattern and therefore different to organize. Bus routes could be organized using a web pattern, allowing travelers to transfer easily. This map could be viewed on a mobile app or website, which could also let users know when the next bus closest to them (via gps) is."3S3AMIZX3VGIQWLPNYXK17U15TIDCI,Seasonal Idea - You get picked up by a SLEIGH looking car (Christmas Season) or a Chinese 2 wheeler (spring/summer). Other ideas related to seasons as well - Valentines Day/St Patty Day/Independence Day Themed etc3S4AW7T80CTYT4W270PQ1MQIM5N4LS,"Autonomic driving cars that can drive without the user's attention. This will eliminate traffic, deaths and some jobs."3S4AW7T80CTYT4W270PQ1MQIMA74LM,Should be an uber limo that pick parties of people up!!!3S4AW7T80CTYT4W270PQ1MQIMGEL4M,"An automated railway sytem that runs through the major streets of the city, which stops at hubs where riders can get out and either walk the rest of the way, or  rent a bicycle, or small automated pod car to finish the rest of their trip to their destination."3S4AW7T80CTYT4W270PQ1MQIMJIL4W,"My city is a little small and close together. Most people use a car or the bus. I think it would be a great idea if more people rode bicycles, and I don't think it would take much longer to get where they need to go."3S96KQ6I9NFZCDN09KSAQHU5T9ADTH,Railway/ Trains/ Subways is very poor people useful transport3S96KQ6I9NFZCDN09KSAQHU5TEKDT1,A Transportation which is used for elder and physically challenged people.3S96KQ6I9NFZCDN09KSAQHU5TTNDTY,I picture a streamlined 'box' like a cable car that is hanging from a line or track throughout the city. It would be shaped like a rectangle with smooth edges and very compact and sleak. It glides up to the booth where people may get on and each cable car 'box' can hold 6 people in 3 rows of 2 with a small walking aisle to the side.3S96KQ6I9NFZCDN09KSAQHU5TTWTDN,"roads that are like people movers so that you dont really have to drive they just move the car for you, save gas and no accidents"3SB4CE2TJW68VNT8UK25PJ75LHWXA7,A new transportation system would include a mono rail system that is built above the streets and sidewalks where pedestrians can move quickly from one side of the city to the next with having to negotiate with traffic. Once you get to your train station destination there will be a system of buses who would be at the train station waiting to take you to a variety of different bus stations. The busses would pick up and drop off and would take you to and from the monorail system.3SB5N7Y3O4F18O00D858CRVX95MG05,solar powered mini bus system - florida3SB5N7Y3O4F18O00D858CRVX9L20G1,Everything would be done through a smartphone app. It would be a transport system that gathers everyone together with common interests. It would be a way to make friends and get to your destination.3SBEHTYCWOEC1A2GB4GKPV2X00JYIG,A public bus transport system that will alllow commuters to get from point A to point B. This will allow for citizens to save money and be energy efficient.3SBEHTYCWOEC1A2GB4GKPV2X00MIY3,roads with different speed limits so people that want to drive faster can go on one and people driving slower on the other