Unique ID,Text: Verbatim3IAS3U3I0GRCDHV3C9H8U4XFQGXB22,"my neighborhood future transportation system will be made up of flying cars. This cars will be able to take off and land like helicopters. There will be no more traffic jams, traffic light, annoying speed limits and harassing cops. People will be able to travel to any part of the world without going through airports and flight connections. There will be new telecommunication and navigation technology that will help the drivers navigate safely without having mid air collisions and also mid air gas stations to refuel the cars."3IAS3U3I0GRCDHV3C9H8U4XFQV6B25,"How about an Uber motorcycle. I know a lot of people that have never ridden on a motorcycle, this gives them a chance to enjoy it."3IFS6Q0HJJUF5OQ7CYOV79EWJFNISM,"Skateboard, hoverboard, rollerblades, ice skates"3IFS6Q0HJJUF5OQ7CYOV79EWJMPSIC,There are a lot of fairly narrow paths in between buildings in my area. It would be good if they could be paved smoother to be used by bicyclists. It would make their travel more efficient and would also increase their safety as they wouldn't have to spend as much time on roads meant for cars.3IFS6Q0HJJUF5OQ7CYOV79EWJN1ISG,A vehicle that is self powered but only when the user operates the peddles under their own power. A steering mechanism is on the upper front area that allows an operator to turn left or right.3IFS6Q0HJJUF5OQ7CYOV79EWJN3SIS,more train/subway connections and better bus service. Better communication as to when buses arrive etc3IHR8NYAM8COKPB0ZSIXI3Z2R7N4P9,A trolly/tram type of transportation!3IHR8NYAM8COKPB0ZSIXI3Z2R8PP4Y,An old lawn mower with the blades removed.  My young daughter years ago used one as you would a four wheeler.  She loved it and got tons of miles out of it as well as fun.3IHR8NYAM8COKPB0ZSIXI3Z2RNCP4F,"A real trolley/tram system, not a bus that they call a trolley. Rails. Automated, pre-programmed directions. Various sensors to determine speed/safety restrictions."3IHR8NYAM8COKPB0ZSIXI3Z2RP6P4D,MOTORCYCLE3IHR8NYAM8COKPB0ZSIXI3Z2RQO4PC,I live in a small town so I think the future transportation system in my neighborhood will be to get rid of normal sized roads and create bike and walking paths all over town. I can see the current roads changing to smaller lanes made for electric vehicles while most of the transportation needs will be fulfilled with bike and walking paths and personal hoverboard type of transportation.3IHR8NYAM8COKPB0ZSIXI3Z2RXD4PF,"I live in a rural area and a lot of people have horses- so an uber or lyft but actually with horses! If you are a nw rider, you can be on a horse on a lead rope, and if you have experience, you can just rent the horse!"3II4UPYCOKIMKXV8SGYFLCJI9T8DQI,bike rickshaw3II4UPYCOKIMKXV8SGYFLCJI9TCDQM,"I would l to see a system of transportation where the service would do home pickups,similar to a bus, only the stops would be made at your home regularly for a monthly or yearly fee."3IJXV6UZ1YU349QUX9OQHZ90X71IRJ,Mini bus services around the neighborhood covering the residential area so that single rides can be reduced3IJXV6UZ1YU349QUX9OQHZ90X7CIRU,"Since where I live gets cold, my idea is to have something like the NYC bike share, but with covered and heated cabs.  Our town isn't too big so you can pick up and drop off like a ZipCar.  The bikes would be electric so you can make it up the hills and to provide heat.  There would be an app to tell you where the nearest bike is and to report anything about it, like it being broken."3IJXV6UZ1YU349QUX9OQHZ90X8CIRW,good3IJXV6UZ1YU349QUX9OQHZ90XADIR1,"People could ride bicycles to work, it would help as it would be good exercise. It could also be fun to do something different, as most others drives cars or trucks. However it could only for for close workplaces, as a lot of work is further then in bicycling distance."3IJXV6UZ1YU349QUX9OQHZ90XAFIR3,i would enjoy seeing horses as a way of public transportation more often3IKZ72A5B5RYFKWC3U1O5IRYGOGFN9,I think that public buses should have some type of bike rack on the back of the bus. Some people want to take their bikes with them somewhere but the place is to far to bike the whole way.  The can chain their bike to the bike rack and remove it when they get off the bus. Of course space would be limited to about 2-3 bikes.3IO1LGZLKA8HTKGXWZ91TFOQY7G681,I believe a good future transportation system for my city would be a highspeed lightrail that can get people to their stop quickly and completely safely3IO1LGZLKA8HTKGXWZ91TFOQYFD68E,"The future transport system would be something which would be very unique, we may see air-car and air-bikes in future with different lanes distributed for them. These would fly at a very low altitude and would achieve very quick speed."3IO1LGZLKA8HTKGXWZ91TFOQYUK68F,"I'm envisioning a system of small feet-sized platforms, along with a handle at arm-height, running on street-level light rail tracks throughout the city. Like an escalator, these continuously run in a loop around the city/neighborhood, and passengers can jump on and off at will. (Access would be prepaid and mediated by a RFID chip card and scanner on the devices.) These would probably move at about 5-10 miles per hour - faster than regular walking, but slower than other forms of transport that require more infrastructure and potential for danger. It'd kinda be like, Razor scooters but built into the city landscape and available at-will. Like a bike-share system, but always there and with no energy or exercise expended. This would be a great way for tired people to avoid walking, and would speed up trips to the closest subway station/bus stop."3IOEN3P9S8UZIKWCXE0ME51IKIG61L,a service in which you get picked up by a car and earn points you can redeem for free rides3IQ1VMJRYUVIURBAR4WR9GLNE5G9AT,"A subway system in my city is badly needed. We have terrible traffic and everything in the city is built in a grid system. It would save time, money and gas consumption for millions."3IRIK4HM3BVJ5N6ADBP6V1K9OI96CJ,"I think that a new mod of transportation in my neighborhood would be a electric bike taxi system. It would be an electric bike pulling a carriage that hold up to 3 other people. The system will travel from people's houses to their work place, local shopping centers and local entertainment places."3IRIK4HM3BVJ5N6ADBP6V1K9OL76CN,There should be a roapway system by which local deliveries should be done by transporting items in tram and dropping them at specific points then the owner can arrange to collect his items.3IRIK4HM3BVJ5N6ADBP6V1K9OS0C60,"Jet packs, if only one had a hydrogen fuel cell jet pack they could zip around in. Stop at any water fountain to fill it up."3ITXP059PXUB0ZADUG9VJATWWODSJX,"Public, foot-based transportation. Something like the automatic walkways in airports, but for long stretches of large cities, particularly between common high-traffic areas. It would probably be best if the walkways were raised, to avoid conflict with other ground traffic. It must also include access for the disabled, be easy enough for even tech-fearful users, and extremely safe (with monitored auto-shutoff where applicable)."3ITXP059PXUB0ZADUG9VJATWWU6SJ2,"I think a good idea will be to use electric cycles instead of a bike or a car in metros. They not only help in decreasing pollution as well as motivating people towards physical exercises.A proper network of e cycles and connected to a main frame can be seen as a new transportation system emerging. Moreover this can also be used as a public transportation system by constructing cycle stands where they can be charged and the cost of public transport can be paid in the machine."3ITXP059PXUB0ZADUG9VJATWWXJSJL,"Transportation by shopping cart taxis. It's fun, it's cheap, and it'll certainly get the kids on board."3IUZPWIU1PIZI0X4W6J8HEWUH97WKF,I think that we need a rail system for our city. Its a growing city with lost of bigger cities around it. A main rail system like a subway would make things much easier to get from place to place.3IX2EGZR7CUZZKA0FR9QT0O0A8WRJI,I'd love for some sort of shuttle system that worked at late hours between major points in town; it's impossible to get around after a certain time with the busses but there's still a lot of people here that need to get from one point to another at night.3IXEICO793U0R48LZXKWKBKDC2HT6T,"I think a method that would improve the transportation system would be to change how turn lanes are handled in America. Overseas, to turn left, you veer off to a lane on the right that comes to a stop so that you don't block traffic waiting to turn and then when it is clear, you drive across the street onto the road you were going to turn onto."3IXEICO793U0R48LZXKWKBKDCK0T6C,A bike path that is in place of all the roads. No cars will be allowed. There will be no worrying about being hit by a car when riding your bike.3IXEICO793U0R48LZXKWKBKDCKA6TZ,"A well established public transport system, like subway, will ease the transportation problem. It will save energy and make fewer cars on the road."3IXQG4FA2U9ND1G2XIWN4R5TW1LB92,"it would be neat to have a cab/uber like service for kids, to bring them to school on demand."3IXQG4FA2U9ND1G2XIWN4R5TW89B94,"A smart car golf cart hybrid, weight relieved and runs on veg oil or electricity. For short trips ie: school,mail box, corner store. Licenced for the road with a top speed of 45mph"3IXQG4FA2U9ND1G2XIWN4R5TWHJ9BU,personal transportation one of the most discover3IXQG4FA2U9ND1G2XIWN4R5TWN39BQ,Segway automated rentals. Like the bike racks in large public cities. You put down a deposit with a credit card and when you return it you get most of the deposit back.3J2UYBXQQMNZBVBU1VWM00I8F3M06E,"flying scooters, whenever the rider can not find a place to ride, he can turn it into flying mode"3J2UYBXQQMNZBVBU1VWM00I8FCD06N,An air based transportation system built on smart drone technology.  The drone would need to be large enough and powerful enough o carry people and goods3J2UYBXQQMNZBVBU1VWM00I8FRF06J,a trolley would be pretty cool i would take that3J2UYBXQQMNZBVBU1VWM00I8FTJ06R,Instead of having dedicated city buses that drive specific routes I would like to have dedicated city taxis that will pick you up on demand.3J4Q2Z4UTZELT3VZ9B35D083G5SQWA,My idea involves the NYC subway; I think tunnels should be expanded to allow bicyclists a path alongside trains. I also believe there should be tighter restrictions on obtaining a driver's license to force more people into public transit. The public buses in my area do not run often enough because too many people have cars and don't use public transit.3J4Q2Z4UTZELT3VZ9B35D083GNSQWA,"My neighborhood would have smaller and more energy efficient cars, somewhat similar to Car2go. Instead of cars on the road with only one or two passengers inside, the smaller and more energy efficient cars would satisfy consumer and environmental needs. The smaller car would include high tech navigation systems, smart phone chargers and wifi."3J4Q2Z4UTZELT3VZ9B35D083GZ9WQL,Segway rental stations placed all over the neighborhood.  Just rent out a segway for a given amount of time and return it to the nearest station when finished with use.  Segways are relatively low profile and can easily be used by most people.3J88R45B2H9FIRZAJ3K2FEW0K2IPXZ,"Apartment complexes that have segway type machines that can be rented out. You can use them to go to the nearby grocery stores, etc, and return after an hour or so."3J88R45B2H9FIRZAJ3K2FEW0KLEPXX,Vacuum tube travel with a central hub in various outlying cities3JAOYWH7VJFZQA2EOVLHIU1Y8B99LT,This idea is about cable bus. Bus moving through cable in air. The cables are places all across the city in air. The bus moves across the cable without any traffic block. There will be stops.3JAOYWH7VJFZQA2EOVLHIU1Y8PUL9I,"Chicago - Chicago has a great system and phenomenal public transport. As far as transportation though I wish the highways in the city acted like slotted cars, similar to trains in which in every highway entrance there would be a dedicated lane/railway for vehicles to travel at fast speeds like trains. This would reduce traffic and travel times."3JBT3HLQF9D4NMZPKL8NCZCBS2QPZ6,"I would like to see a system of localized automated delivery. A system which is run as a utility for the town or city in which the focus is put on small businesses in the area. I think this could have hyper-local economic benefits, as it may help small businesses steal back sales from online marketplaces like Amazon. I see it being a motorized electric drone, that could use something like a bike lane to bring goods to local neighborhoods from small businesses in area.  it Could be coupled with a publicly run website for ordering and added revenues from ad placement on site and/or vehicles could help give money back to towns and cities."3JBT3HLQF9D4NMZPKL8NCZCBSLCPZU,"I live in West Philadelphia!  I'm not going to say I've never complained but we've got Septa and its very good. Green line Trolleys come every 4 to 10 minutes. It could be better if it was not so expensive, ran 24 hours a day, and the entire route was underground (instead of just the part through Penn campus) but generally the trolleys have always been there for me when I've needed them.  99% of the time I ride my bike and there isnt anything that can beat that.  Unless it never rained.  This weeks blizzard was fine, though it slowed me down a little but I dislike riding in the rain.  I also have a small motorcycle that I got with the intention of using the neighborhood and the rest of town but I found dont enjoy riding it in the city at all. I have no patience for sitting in traffic when I could be on a bike and moving.  The motorcycle has proven surprisingly good for long distance trips:  I take it central Florida, New Orleans, Chicago etc.  I hope to never again live in a place that requires a car and its massive drain of money and space."3JBT3HLQF9D4NMZPKL8NCZCBSLIZPA,"What if you have self-propelled vehicles (i.e., pedals like a bike) that provide protection against the elements (a roof made of canvass and plastic walls).  These could carry 4-6 people, and someone strong could volunteer to provide the pedal power each day."3JBT3HLQF9D4NMZPKL8NCZCBSLPPZ7,I would enjoy having a limousine service in the neighborhood. That would be a safe and comfortable mode of transportation.3JBT3HLQF9D4NMZPKL8NCZCBSU7ZPH,Imagine thousands of public bikes for you to use for short trips around town. Now imagine tens of thousands of people riding these bikes every day3JC6VJ2SACUZT49YOEJAX0GLSN55AY,Skijorking with a sled to carry items3JCG6DTRV41G96ZDX24ZLBQHS1IQQ7,public busses would help out my neighborhood a lot. it would help on emissions.3JJVG1YBEC84CEEQUSJ6SB0RAD8B5X,"In my neighborhood, there's not a lot of space, so I'd have to go with covered bikes of some sort, or one of those neat bike trollys. That would be a neat way to get around and exercise."3JJVG1YBEC84CEEQUSJ6SB0RALZ5BY,Solar powered golf carts. You could have stations kind of like bikes and check them out and return them.3JMSRU9HQJ5JHB5PAA39XH0BQ0QEVE,"A driverless mini-coach will be the norm. Summoned through an ""uber"" type app, the responding vehicle will be selected based on pickup and destination points. All riders will be photoed and violators cited."3JMSRU9HQJ5JHB5PAA39XH0BQ6DEVD,I can see a transport type system where someone steps on a pad and it transport them digitally over to where they want to go within a town. kinda like the thing they had in willy wonkas chocolate factory but without the death ray pointer thing it would be just a pad like a dance dance revolution pad.3JMSRU9HQJ5JHB5PAA39XH0BQQAVEV,"The suburbs are not currently served by the bus system. I believe that each suburb should get its own bus, which will take riders to a bus stop in the city. There, they may catch another bus or walk to their destination."3JMSRU9HQJ5JHB5PAA39XH0BQVVVEQ,A electric scooter sharing program for getting around town without having to drive a car and use too much gas or take up too much space.3JNQLM5FT5XOQQHF3M6287TK2B62LD,The second new type of teleportation that I can think of is a flying car. It would either have wings or a hover pad on it. It would be able to go to landing zones and be able to go to places faster than what is normally possible.3JNQLM5FT5XOQQHF3M6287TK2RY2L1,Driverless cars that talk to each other.3JNQLM5FT5XOQQHF3M6287TK2WAL26,A lazy river that takes people to St. Charles so they can go to the french quarter.3JPSL1DZ5TA3JTF4SEFWRHG7JLGANU,"I want an elevated railway that preserves nature, resists going down during snow and bad weather, and reaches all areas of my city. It would be public transportation and have low-cost monthly passes. It would also run on renewable, clean energy."3JPSL1DZ5TA3JTF4SEFWRHG7JT3NAA,A bicycle service for when you are not in a hurry.3JRJSWSMQIWZ5236Q0X3EM8SZ3Q3E9,"Automated cars that can come pick you up at the push of a button on android or apple devices, and directly from that device, you can pick from a map where you want to go. Submit your payment, and off you go!"3JRJSWSMQIWZ5236Q0X3EM8SZ3QE3K,My idea is a car application that notifies you when you get in about the weather and road conditions.3JRJSWSMQIWZ5236Q0X3EM8SZ6PE3P,self driving car pods that will pick you up and dro you off then move on somewhere else3JRJSWSMQIWZ5236Q0X3EM8SZFC3EJ,"most of the people are going office by car . In rainy season if you go by car that is not problem.but scooter using people and children are affected by rain . for that if we fix wind resistant ,water resistant umbrella in the bike . In the handle bar that will be very useful for two wheelers .If we make that kind of vehicle that will become very successful .because of rain only most of the people will go by car . or else they will go by scooter. that will reduce the traffic jam."3JRJSWSMQIWZ5236Q0X3EM8SZR8E3E,A new transportation system in my neighborhood would be rentable bicycle stations! They would be scattered all over the city.  You would simply put change into a machine or swipe a credit card and a bike would unlock.  You could then use it to ride all over the city.  You could return it to any other rental rack.  The racks would also have hand sanitizers and wipes so you could wipe down the public bikes before using them.  This would greatly reduce gas and emissions in the city and people would get good exercise biking around!3JRJSWSMQIWZ5236Q0X3EM8SZS43E1,transport3JV9LGBJWUPMB5SJFT7J2SRF7DTGOW,"Dedicated lanes for motorcycles and bicycles etc, block cars from most streets, encourage renewable energy sources. No tolls for motorcycles and bicycles."3JWH6J9I9TO823KWYSFSMS0D1QZNBA,We could have hover board paths that would allow people to go short distances without driving all the time. A path to the side of the road strictly for hoverboards or other electric devices used to get around.3JZQSN0I3RLS5SFQGQOTFYI1F7DGFB,I think it would be great to have razor scooter stations where you could rent a scooter for a certain amount of time and then check it back into a station when you are finished.  I imagine there would be stations all over the neighborhood so everyone could have access.3JZQSN0I3RLS5SFQGQOTFYI1FFHFGU,"A smartphone app similar to uber but for carpooling. Once it hits a predetermined amount of users needing a ride in a concentrated area, the app suggests grouping the users together and designates possible drivers to pick them up if users agree."3K2755HG5TEPT85ZE0NL9DF422KDFV,Scooter  is used very good technologies transport. But middle class people  is used  transport bicycle3K2755HG5TEPT85ZE0NL9DF42RZFDQ,"I live in a very hilly neighborhood. I suggest a funicular! A funicular is a railway built on a steep hill with tram cars for transport. Put it on one of the hills in the center of the neighborhood. People would be only a short walk (less than 10 minutes), hop on the funicular and it could take them to the church, the school and the neighborhood business district. Bam. No more worrying about going up and down the crazy hills, especially in the winter. Booyah!"3K3R2QNK8CE290P8X9DI9HXHLZGU9G,A system of mopeds that you leave at different stations and ride around on only paying to rent them3K4J6M3CXF4X91YI5A211X7AIFLGAV,Imagine your favorite night spot looking like First Fridays in Uptownbikes everywhere3K5TEWLKGWMVXG7B6TT0IWY3IOWIVG,A community system that is managed electronically and requests cars any time of day. All cars are electric and will take you anywhere you want to go for a set charge and there are maintenance teams that come and clean cars during the day.3K5TEWLKGWMVXG7B6TT0IWY3IQ9IVX,"Maybe like a smaller plane with easier landings and takeoffs so that small planes can work as long distance taxis. So, you can go up to 500 miles on this small plan in lower altitude faster and cheaper than on a commercial flight today. Maybe in the future they can even figure out how to have a large aircraft that is the size of a conference center and regulates pressure so you can walk around and hang out and travel at the same time."3K772S5NP9MEZAA55LM5IG92IBDEH2,"Handicapped taxi. Public transportation is awful in my area, so if you are in a wheelchair then you need an expensive handicapped van just to be able to get around. Some taxi wheelchair van options would be great for people who can't afford a $30,000 wheelchair van and might otherwise have a hard time getting around."3K772S5NP9MEZAA55LM5IG92IO0HEI,I believe that we should have personalized rail system fro our neighborhood. The whole nei8ghborhhod should have a few of them available to different destinations. When someone wants to go there they hit a button and it sends it to them.3K772S5NP9MEZAA55LM5IG92IO1EHG,"Horses, everybody has horses where I live, so why not use them for transportation as well!"3K772S5NP9MEZAA55LM5IG92IOWEHB,"My idea is a combination of self driving cars, rideshare and a train. Commuters would pay for a ticket and a line of connected self driving cars would take commuters going the same route/direction to a certain dropoff point, like a train does. Then when the string of cars reaches the stop point, each passenger can enter their desired destination into the touchpad screen in the car and they would be driven to their individual destinations. The self driving cars would break off individually from the train to take these passengers, then they'd return on their own to the ""train station"" to go pick up more passengers."3K9FOBBF2IUKFC68P54M0VWIDFLLNT,I feel the best is a transportation tunnel.  It should run around 150 miles per hour and provide food accommodations as well as sleeping areas!3K9FOBBF2IUKFC68P54M0VWIDKCNLW,A car that scans particular people before allowing it to run to prevent thieves.3KAKFY4PGVDBL75SMJNUZ16KRFR3IE,A type of solar powered helicopter that picks people up and drops them off.3KAKFY4PGVDBL75SMJNUZ16KRFXI3Z,Service that allows you to call for a bus and the closest one will arrive at your location3KAKFY4PGVDBL75SMJNUZ16KRHA3I1,"An electric powered non-track trolley that uses solar to charge batteries, It would be on tires and pulled by a highly efficient electric vehicle with a natural gas powered generator as back-up power. The open air passenger trailer would hold 10-20 people."3KAKFY4PGVDBL75SMJNUZ16KRK8I3K,"I would like to see a bicycle highway.  It would go the length of regular highways, but be for bikes and pedestrians.  It should be wide enough for fast moving road cyclist, it should have passing lanes, and little road crossings.  There should be frequent on and off ramps.  There should also be many large parking areas.  Ideally it would even lead to public transportation areas with ample bike parking."3KB8R4ZV1FI2SB3ABO2XW8RG00WGBM,I would like to see rocket skates as a transportation method. They might need something to help people keep balance but they would be fun to use and practical for some peoples lifestyle.3KB8R4ZV1FI2SB3ABO2XW8RG09LGBT,I think that there should be some way that all the christmas trees at the end of the season could be recycled into some sort of useful wood.3KB8R4ZV1FI2SB3ABO2XW8RG0E2GBK,"Bus passes can be used for bike passes also.  Take the bus as far as it goes, then  switch to a bike or scooter for rent."3KB8R4ZV1FI2SB3ABO2XW8RG0E6BGJ,This idea uses the sky!  A station or helipad is set up and an aircraft is used that utilizes wing and rotors. Basically a cheaper and a bit smaller helicopter.  This is ideal in my opinion as it is a vertical takeoff which takes far less space than a runway.3KB8R4ZV1FI2SB3ABO2XW8RG0E9BGM,Use of earthbags for construction of houses should be a standard practice with standerdised engineering built in the program.3KGTPGBS6YWR9G49C0Y3ZUP3FFKU2A,"A personal transport vehicle, perhaps shaped like a scooter or segway, that collapses and folds into a backpack with straps that retract."3KGTPGBS6YWR9G49C0Y3ZUP3FGG2UG,Hoverboards for everyone - once the technology is figured out that is.3KGTPGBS6YWR9G49C0Y3ZUP3FPJU2T,"I think a great idea for a transportation system would be a neighborhood or city that bans cars and uses all bikes to get around. This would really help the environment and people in this town would also be in really good shape. It would have to be a town that doesn't get very cold in the winter, like where I live, where people could use their bikes comfortably year round. Each bike would have to have a small basket though for people to carry their stuff."